username;title;date;region;text;stars
David T.;S8 Ultra Pro is Almost Perfect;October 26, 2023;United States;I've had the S8 Ultra Pro for almost 3 months now, and it's the best all-around robot vacuum I own. I also run 3 other robots: the Ecovac Deebot T8 AIVI, an iRobot J7+ combo, and another iRobot J7+. The S8 Ultra excels in several categories: 1. Reliability: It doesn't get stuck or lost, with the Ecovac T8 as a close second. The iRobots often require placement on the dock at least once a week. 2. App and Mapping: The S8 has the best app and mapping capabilities, with the iRobot coming in a distant second. The Ecovac T8 struggles with mapping as they get deleted randomly. 3. Mopping: The S8 is the best mopping robot, while the iRobot J7+ combo falls way short in this aspect. 4. Vacuuming: The S8 excels in all-round vacuuming, although the iRobots perform better on carpet, and the Ecovac T8 is slightly better on hard floors. 5. Dock: The S8 boasts the best dock, whereas the Ecovac T8 has the worst. 6. Navigation: The S8 has the best navigation, with the Ecovac T8 as a close second, while iRobot's navigation is subpar. 7. Obstacle Avoidance: Surprisingly, the iRobot performs best in obstacle avoidance, but it tends to bump into walls and furniture. The S8 and Ecovac T8 rarely touch any obstacles. However, there was a disappointing incident when my S8 vacuum ran over a pet mess. After cleaning it thoroughly, it's back in action. But it’s frustrating my very expensive robot failed with the pet waist. Overall, the S8 remains the best robot in my collection, but I wish the liquid bins were larger as I have to fill/empty them every two cycles. Doubling their size would be ideal.;4
Kyle Bellflower;The BEST!;April 7, 2024;United States;I was back and forth on spending so much money for a robot mop/vacuum and waited for the price to drop ( got it for $999) This thing is amazing. We’ve had no issues with it. If you’re on the fence like I was for 10 months pull the trigger. You will not regret it.;5
Madyl;Product is good and hopefully will get more features in future;March 24, 2024;United States;I did like the concept of this product but currently it is too expensive so I will wait for some time before buying an advanced version;4
Jason Chamberlain;A very intelligent robot vacuum/mop;August 30, 2023;United States;"I have been a Roomba user for many years, and still own 2 but my Roomba S9+ has become increasingly unreliable with software updates, so I moved it to a less challenging floor and purchased the Roborock S8 Pro Ultra+ for my main 1000 sq. ft. floor after reading many reviews. So far (11 days and about 10 cleaning runs in) so good. This is by far the most intelligent robot cleaner I have ever had, and it's almost spooky in action. To begin with, its mapping feature is excellent (far superior to my best Roomba)! One run on fast mapping, and it had all the rooms (7) correctly laid out. It correctly identifies bare floors (and wet mops them) and carpets where it increases the vacuum power and retracts the mop. If I didn't watch it in action, I might not have believed it could really do that. So I can send it into a room with bare floors with throw rugs with no problem. At the beginning and end of a run it cleans the built in mop, sending dirty water to tank for that purpose, loading clean water into the robot, then it air-dries the mop. Lastly it sucks out dirt from the vacuum filter receptacle and starts the recharge process. It clearly announces it is going to do each of these steps (which fascinates my cat.) So... Pros: Hands free automated floor cleaning of varied surfaces (doesn't get stuck and it doesn't damage my oriental rugs, either) Cons: User interface for initially customizing the map is difficult to use; User interface for setting up selective cleaning jobs (this room or that room kind of thing) is also a little unfriendly - takes some fooling around to get those straight; Oddly doesn't warn you when your fresh water tank is empty. Other than that - GREAT product";4
ryan flournoy;Actually Not That Great;March 11, 2024;United States;My dogs rarely make a mistake inside but this does not recognize pet messes and it will spread poop. The mop portion isn't good at all. My floors are hand scraped wood so it's wavy and the mop cannot get in the very shallow valleys so I have to clean the dog paw prints myself. The vacuum portion isn't great at all. I frequently have to go over areas with a stick vac that performs far superior. It gets stuck on cords, shoe laces, corners of rugs, socks, t-shirts, in actual corners with no obstruction, kitchen tables, chairs, etc. I've had to move it away from a corner because it thought there was a cliff or it was out of bounds. For the price I would not purchase this again. You set it to run while your out and 5 minutes in it's stopped because it thinks your living room suddenly developed a cliff or a sock that the dog pulled out clogged the rollers. Then it needs to charge again because just sitting there giving an occasional notification is enough to burn the battery down. Which brings me to my final point, it cannot clean the 1400 Sq. Ft. area without running out of battery. So it docks, charges, then kicks off again several hours later once it's charged. Why bother with a schedule if it's gonna clean throughout the day because the battery is weak?;3
Suzette Sneath;Much better than Top of line Roomba products;September 9, 2023;United States;We have a pretty large house, so I needed two roomba i8 vaccums and 2 roomba m6 moppers to get the downstairs cleaned (without it taking 8 hours). One of my braava m6s stopped working, and it was less than 1 year old. Out of frustration, I decided to try a new product and purchased the Roborock s8 pro ultra. Originally I figured I would just use mopping feature and keep my roomba vaccums. I am so glad I switched to this s8pro ulta. The vacuuming is fantastic, and the mopping capability is far superior to braava. So many features that make this a way better product that I didn’t even think about before. The fact that I don’t have to change the mopping pad everytime is so nice! With a separate vacuums and mopper system you have to let the machines run almost all day so each one finishes their job before the next one starts. Way better and more efficient to have one machine do one pass throughout the home and handle both vacuuming and mopping. The s8pro ultra is actually more quiet than the roomba too which is really nice. I think the most important feature for me so far is that Roborock can ran at night while everyone is sleeping. Roomba would never run at night as it needed light and that was a huge downfall. Roborock did wonderful last night in the dark! I know this price tag is a lot, but I wish I would have purchased this in the beginning as I would have saved money in comparison to roomba products. The mapping feature in Roborock is way better and takes no time at all! I was also worried about my rugs getting wet with the mopper system. We have really expensive and thick rugs throughout the house. One thing I didn’t realize about the Roborock until after I purchased it was it has the ability to start and go right to vacuuming the rugs first, then it will do mopping afterwards so you don’t have to worry about that. I did check to see if any rugs were damp or wet after switching from hard floor to rugs and nothing! Our rugs are about 1/2 inch thick, so again I was extremely impressed. I absolutely love this machine and highly recommend this to anyone looking or on the fence about what product to purchase. I hope it continues to perform as well as it has in the last 24 hours. Hoping they come out with a robot to do laundry next! 🤣;5
Austin;Best Customer Service;March 15, 2024;United States;;4
A. Antonio;Waste Your Money On the Other Brand and Then Buy This One;December 4, 2023;United States;I saw the prices for the Roborocks and balked. I couldn't justify paying that, so I bought the other big name brand. At first it did a decent job, but it was never perfect. Why? - It never finished a run. It almost always got stuck somewhere and needed to be rescued. - Parts wore out faster than I would have liked. - It often thought the bin was full when it was just dirty. - The mop (separate unit) had to be cleaned every other time and cleaned every time. Finally the vacuum stopped emptying. After looking online, I had to take the stupid thing apart and clean parts of it. That helped for a while, but then one of the rollers jammed, it didn't know, broke, and started spinning in the broken mounting. What happened? It got so hot the plastic melted. I can only imagine if I hadn't smelled it, the possibility of a fire would have pretty good. That was the last straw. I bit the bullet and bought this beast. After a week I learned that buying the other was a total waste of money. How is this better than the other guys? - Mapping is far superior. - Setup is easier - This never gets stuck - The mop actually cleans the floors (the other seemed like it pushed dirt around) - If this says the bin is full - the bin is full. - This goes places the other one wouldn't. - I have a GSD. This has pulled up a SHOCKING amount of hair, I didn't even know was in the carpet. - This cleans much better. - This one is quieter when it runs and much quieter when it empties. - The other one would get lost and good luck finding it. This one shows you on the map if you accidently shut it in the bathroom. - Real time tracking of the cleaning job Time will tell if this holds up well, but so far it's miles and miles beyond the other big name robot vacuums.;5
LarryTru;Works great!;April 1, 2024;United States;;5
Ben;Amazing robor;March 18, 2024;United States;;5
Tanmay;Will not connect to wifi if the password has special characters;November 27, 2023;United States;"I was forced to change my wifi password to not use any special characters (which is recommended to make the password stronger) there by having to choose a weaker password. Moreover had to reconnect over 70 devices (laptops / phones / tv / speakers/ security system / smart switches , plugs / smart devices ) .. pretty much every single thing connected to wifi because this fancy $1600 worth of floor cleaning robot won’t work unless I change the password . Moreover here’s the official troubleshooting instructions that were sent by manufacturers Helpdesk 🤷‍♂️some of which advise changing routers DNS/encryption/IP address . This is a bit too much to get a vaccum/mop to work - Our devices don't support 5GHZ wifi. If your set-up steps are correct but it's still not connecting, try methods below: 1. Please go to google play or app store to check if your Roborock app is latest. If not, please upgrade it to latest one and try to connect wifi again. 2. Make sure the password of your wifi you've input is correct. 3. Don't use an android tablet, iPad, iPhone 5 or iPhone 5C to connect the robot as there might be a compatibility issue. 4. Enable location permission for the app. See attached picture. 5. If you're using IOS 14 or later systems, please enable local network for the app. See attached picture. 6. Pay more attention to the select wifi step. See attached picture ""select your home wifi"". 7. If there are special characters like !@#$ in your wifi name or password, it's suggested to remove them in the router settings. 8. The robot doesn't support WEP encryption mode. If your wifi is WEP, change it to WPA or WPA2. 9. If you understand the router's setting very well, try to change DNS to 8.8.8.8 in the router's settings page. 10. Reboot your device and router and try again. 11. If your phone's cellular network or VPN is enabled, please disable them and try again. 12. Check if your router's IP address is 192.168.8.1. If yes, please change it to other IPs like 192.168.9.1 and try again. If none of those solves the issue, please download another app called Mihome to try the connection one more time.";3
WeidonYan;The best product I bought in 2024;April 12, 2024;United States;;5
TH;Amazed;March 23, 2024;United States;I bought this Roborock with a lot of doubt. I am so shocked at how well it cleans. Each morning when we come in to the office, it’s like the entire floor has been swept and polished. I am so impressed with this machine! If you have hardwood or laminate floors, get one of these. You won’t be disappointed.;5
Mark Busalachi;Best cleaning appliance ever purchased.;January 7, 2024;United States;Well I have to start out by saying, yes this beast is pricey however worth every penny! I have owned the competition for several years but nothing compares to Roborock. This is a well developed product that operates beyond expectations. My carpets and floors are very well cleaned and I.have had not one issue with this robot. I get the maintenance on it, because being an engineer of sorts, any product of this caliber need to be maintained thoroughly. Regularly cleanings, tanks, cleaning brush and filters a must but really it only takes about 20 minutes to complete. Usually once a week on a Sunday, I wipe it down completely, pull the brushes and rollers and clean the hair that builds up on the stems. Other than that, cleaning the dirty water tank regularly keeps the unit from foul smells and buildup. Would purchase again if new model immerges but very happy with this one. Also would like to say, with any robot vacuum, you absolutely need to prep your home for the scheduled operation of this device. Making sure no wires are left on the floor, if pets live there, make sure there is no droppings or vomit on your carpet or floors and just pick up anything that might be a hazard to your robot. Other than that, would totallly recommend this product if affordable to you.;5
Charles H.;WHEN WORKING - ITS AMAZING, HOWEVER BAD FOR PET TOY OBSTACLE AVOIDANCE.;December 28, 2023;United States;This product works super well, ONLY when all goes well. More floors have never been cleaner. HOWEVER, THERE IS A MASSIVE DESIGN FLAW! Unfortunately, this product has HORRIFYINGLY TERRIBLE obstacle avoidance for small objects, cords, & strings. I wish it had a feature to perhaps reverse the rotation of its suction brushes to unjam itself. I have a cat who likes to take out her toys and puts them all over the floor when I am not home. She's a kitten, so she wants to play and it would be wrong to curb this behavior. Because of the Roborock absolutely terrible obstacle avoidance, even if they claim it is so much improved, it is horrifyingly bad for such an expensive vacuum. Everytime my cat takes her string toy out (which is a daily occurance) it will end up jammed in the feeder. It is now at the point, that I must be home to monitor it - at which point I might as well just vacuum and mop myself. I like for it to clean when I am not home, so I don't need to hear the loud noise. But, now it is at a point where everytime I leave I have to make sure everything is off the floor or it will jam up and I'm scared will eventually break the product. They really need features to fix this as most homes will have something like this eventually. Also, the rotating bristles that draw in the dirt, bend within a very short amount of time of using it. I read about this in many reviews& recommended to buy a separate bristle online that works better, but now I totally see it first hand. That being said - all around, its a great product, I just wish the obstacle avoidance was a lot better.;3
Tarasa Escoubas;Best purchase of the year!!!;January 11, 2024;United States;Love my Roborock s8!!! I have been watching it since it was released and wanted to wait until there were a bit more reviews before making this investment. I purchased around the holidays so it was discounted down to 1199. Now that I own it this smart device I would have definitely paid full price. Its such a time saver and it works great. I do walk around and make sure that things are picked up but it will notate things on the map if it finds things it doesn't expect. The mapping is so easy & it improves every time it runs. This saves me many many hours each week in vacuuming and mopping.;5
Scott196941;Cool features - not as smart as it should be for the $$;January 6, 2024;United States;It has great features like cliff sensor and smart object avoidance which it does well. I like the robot in general and it’s my first experience with one. The problem is the path it takes makes absolutely no sense and is not efficient. I set it to vacuum first, then mop. It goes through the vacuum cycle (unfortunately, it goes over and over areas where it makes no sense and it acts confused). Then when it goes to mop the hardwood, it will randomly go back to sweeping carpet that it has already swept in rooms 2 rooms away from the mopping rooms (it does this multiple times and makes no sense). I have high pile light colored carpet and I don’t want the wetness from the mop on the carpet. So this feature doesn’t work properly. Because it goes back to sweeping carpet and goes over the same path multiple times (I counted that it went over the same path 6 times on multiple occasions like it’s confused) when it should be mopping, I found myself stopping the entire cycle and simply using the clean a specific room feature. The biggest reason I stopped this unnecessary sweeping was because the battery life is poor. I get 1hr 20 mins before it has to recharge. I have 1,500 sq ft on the first floor so it has to charge 4 times and it takes at least an hour to recharge. I started the cycle at 9:30am and it didn’t finish until 6:30pm. This is why I gave this robot 3 stars. For $1,500+, this robot should be smarter and more efficient than it is. I don’t feel like I can start it when I go to work and have the house be done by the time I get home. Instead, I have to manage it. I could’ve paid for a $800 robot for that hassle.;3
briggs in MI;Works well for sweeping and light mopping.;October 8, 2023;United States;Works very well for sweeping and light mopping. Floors look clean and dust free afterwards The only issue I’ve run into after owning it for 4 months is I keep getting the message to “Check for Air Duct blockages and empty the DustBin”. When I look the Air Duct is blocked and the dustbin is full. I empty and unclog them, but it just keeps happening again. It happens at least every other sweeping and since it requires me to disconnect the power to the dock, turn it upside down, unscrew 3 screws to access and unblock the duct, while doing so, dust and debris are spread all over, negating the dust free, hyper allergenic disposal system. This process is quite inconvenient, dirty and time consuming. I have it set to vacuum twice a week, mopping one time, so I am doing this manual unblocking of the duct once a week. Because of this, I’m still on my first dust/debris bag as it has actually gotten a little debris in it. We only have 1 short hair cat, so we do have some pet hair, but not a ton of it. If they could fix this issue, I would give this product 5 stars. I’ve had 3 other irobot vacuums and this does the best job of keeping the floors clean. This is my first auto empty, I just wish that feature actually worked.;4
Ray;You Deserve This;March 7, 2024;United States;;5
chris;Disappointed. Lacks performance and longevity.;February 6, 2024;United States;Purchased Oct 2023. Within 3 months of usage the Ultra 8 started malfunctioning. 1. Rust ( look at the pics. Your mop pads will bleed rust from the machine to the mopping pads) 2. Yes, contacted customer services, they wouldn’t replace the item but they will “repair” it under the “warranty”. Found my own box, secured the packaging to prevent shilling damages, utilized their UPS label to their repair shop. 3. 4 weeks since submitting the initial claim and receiving the “repaired” vacuum. Take a look at the video I uploaded to determine if you think that’s mopping the floor… the mop is no longer making contact with the floor. Update March 2024: Vacuum was sent for repair, this took total of 3 weeks to receive the “repaired” vacuum. The rusted parts were replaced but the mop feature wouldn’t mop. Just made drops of water along the way. Emailed them again and they instructed me to mail it back to them so that they can send me a refurbished vacuum. This took another 3-4 weeks (that’s including emailing back and forth, shipping it back to them and receiving the refurbished item. The result is: it works but the machine is much louder when vacuuming. And the mop works 70% of the time. This is frustrating. Great vacuum when it’s brand new until you run into issues. This machine was not made to last. Sorry- I do not recommend. And their warranty process is very frustrating and time consuming.;3
Amazon Customer;Not the Unicorn Vacuum;February 29, 2024;United States;I was very excited to try out this vacuum after extensive research, and it was clear that this is the best of the best out there. I wanted so badly for this to be our Unicorn Vacuum that solved the following: 1. Vacuumed thoroughly , including wall edge 2. Washed tough stuck on messes 3. Avoids obstacles by moving around them without getting Stuck However, this was our reality 1. Vacuum suction did not meet expectations as crumbs ( big and small) would be left behind in random areas 2. Washed superficially but didn’t get messes that were mildly stuck on ( post baby throwing food on the floor) 3. Struggled with obstacles such as toys and shoes, it would skip the area entirely ( I hoped it would atleast vaccum around the object ) Ofcourse these issues could be solved by not having sticky messes on the floor that need to be mopped and having absolutely minimal obstacles in its way, however with kids this seemed unrealistic which for us defeats it’s purpose. I would recommend this product for someone with no pets/ kids that just needs a regular upkeep of standard messes.;3
DizziD;A huge upgrade from the S5 and impressively hassle-free to use even in a 6k sqft house;May 11, 2023;United States;"We decided to upgrade to the S8 Pro Max after using the S5 with great success for 3 years, and it basically took everything we liked about the predecessor and improved on it. As long as you're working within the type of environments that are good for floorbots (mostly hard floors and short rugs, and a reasonably controlled amount of clutter), this is the best one we've ever owned. Pros: - Initial mapping is VERY quick compared to previous versions - Slightly larger map/storage capacity for floorplans - Cleans faster and more effectively than the previous models - Very solid battery life for a very large house (650 sq feet takes about 25% of the battery and 1 hour) - Moderately quieter than predecessors - Mop cleaning system works very well and seems to eliminate the old ""dirty rag"" mopping approach - Good at avoiding things that will trip it up (rarely gets stuck - maybe once a month with daily use) - Dock system actually works and minimizes daily maintenance (the bin ends up surprisingly clean) - Doesn't seem to have any issues with pet hair (a German Shepherd and a Husky, so we're not messing around here!) - Locates missing shoes Cons: - Dust bags will not last the implied month in a large house with pets and $5 a month in vacuum bags seems a bit much - App alerts to refill/empty dock bags and reservoirs would have been helpful - Don't let it near a shag rug. Ever. - Map management (especially initial room division) is still clunky, but is better than before. - The inability to rotate ""spot cleaning"" zones makes them a lot less useful unless your house is perfectly square and facing a cardinal direction (see pic) - Still can't save cleaning zones for areas that you regularly spot clean. Good to know: - Dusbtin emptying is very loud - not louder than a normal vacuum, and perfectly reasonable - but not something you want to do at night or during dinner. - Disable schedules if you have a sick pet - obstacle avoidance is great but it still can't detect a puddle of yacked-up kibble and will track it all over your house. - Even in a fairly clean home, frequent mop washing (the 20 minute default is pretty good) will still go through a lot of water - check the tanks often. - You may want to stock up on dust bags - with 2 dogs and running about 2 hours a day, we are going through a bag every other week. It does do an admirable job packing them full, though.";5
jason;Best thing ever;April 16, 2024;United States;We have tried many different robotic cleaners and this one is the best by far.;5
