username;title;date;region;text;stars
In Awe;I absolutely L.O.V.E this Vacuum;August 14, 2023;United States;I waited for about 6 weeks to write this review because sometimes, a product works well at first but the more you use it the more you find its flaws! This vacuum is amazing! I have 3 dogs and 3 kids and this vacuum helps keep me sane. I run the vacuum and mop 4 days a week and just the vacuum 2 days. The other day I sweep and mop myself. Pros: * Easy to set up and quickly mapped out my house. * Takes very little maintenance. Just fill clean water and empty the dirty water every 3 or 4 days. I had a Shark combo robot previously and it couldn't even get thru 1 cleaning without me having to manually add water. If you leave the dirty water any longer than that it will smell. I didn't notice it from the machine but when you empty it, you will smell it. It has been 6 weeks and I have just today emptied the debris bag and I have 2 Aussies and a Golden Retriever that shed A LOT. * It really maintains itself, cleaning mop head every 15 minutes and self empties its dust bin. The Shark vacuum only self empties the dust bin if you are only vacuuming. If you are using the combo vacuum/mop, EVERYTHING is manual for the Shark. Roborock rocks with this feature. I do not have to do ANYTHING for days. * App is easy to use and makes suggestions for no go zones. * I can see what the vacuum is doing or any errors thru the app and sometimes can clear them remotely. Cons * Expensive but I think well worth the price * Like others have said, has a difficult time with cords, however, I bought cord organizers with boxes and ties from Amazon and fixed this issue. * Sometime gets stuck on my rug but usually I just start it again remotely and it unsticks itself I was worried about spending so much for a vacuum/mop but I am in love with this. I have had other robot vacuums and mops and this one is head and shoulders about the others. I did NOT get anything for free either. I paid full price for my Roborock.;5
Patricia Grau;I love it, save a lot of time of my day;March 25, 2024;United States;It is really good, the app shows you when you need to clean the tanks, which saves me a lot of time on cleaning. It doesn't get to the corners, and if there is a small carpet, it won't clean properly in that area.;5
NehaJ;easy to operate, fair cleaning, Self emptying;February 7, 2024;United States;;5
harmon;4g network;February 3, 2024;United States;If you have 5g for internet robot app will not work. Robot only good for up to 4g. I was shocked to learn this. I have to manually turn it on cause app on my phone doesn’t work. On a positive note the robot cleans and vacuums very well;4
Amazon Customer;Best thing since sliced bread!;March 25, 2024;United States;I would buy this product over and over again. We’ve had it for eight months and it has functioned perfectly. It vacuums great and mops quite well too. It is wonderful to have the floor clean even with a constantly shedding dog in the house.;5
Zack;Design flaws and overall inferior to roomba;April 6, 2024;United States;Comparisson to roomba i7. I switched my roomba for this model and put it in the same previous location as my roomba. Compared to roomba this has a harder time finding home and charging itself. It frequently misaligns and sits on the station without charging until its battery dies. 1-2x a week I have to manually realign it to get it to charge. Compared to roomba it also gets stuck more often under chairs, etc. The mop feature is great and the clean is better on the hardwood floors section. Design flaws with the water tank. The lid is designed so it doesnt stay open on its own. You cant set it in the sink to refill it, you have to manually hold it open the entire time - see video. Overall it is a good concept of a product, but the programming doesnt seem as good as roomba has several annoying design flaws.;3
Amanda Martin;Must Have!;January 3, 2024;United States;I previously had a iRobot Roomba vacuum and it was awful. Made a ton of racket, stuck constantly, etc. It really made me hate robot vacuums. I work at home and have been really busy so the floors always get on my nerves. We have 2 cats and a dog and the floor just always seems dirty. It stressed me out. So, i started researching robot vacuums once more. i came across this one and looked at the listing probably 5 times over the course of two months. It was so expensive but the reviews were glowing. So I took the plunge and am I glad I did! This vacuum is magnificent! It has rarely gotten stuck mostly on my very odd metal coffee table, the transition from moping to vacuuming on rugs is A+, it's rarely sucked up anything it's not supposed to, mainly hoodie strings my cats like to drag from hiding places. The map and room/zone set up is a piece of cake. The app response is almost immediate. I truly cannot say enough amazing things about it. I do not use their cleaner but other plant based cleaners in the tank and there are 0 streaks on my floors. BUY IT. I swear it's worth it.;5
Sarah;So amazing, everyone needs one!!!;March 8, 2024;United States;This mop and vacuum combo is just what this busy momma needs!! The app was super easy to set up and the device maps the whole house. With two floors, you are even able to just move it downstairs and have it map multiple floors.;5
Sydney;Worth the $$;September 4, 2023;United States;Let me start off by saying this was not an easy purchase decision for me. I have struggled to come to terms with spending this amount of money on a vacuum/mop, but it truly has increased my quality of life significantly. And that’s what money is for. I decided on this model because I did not want a camera going through my house based off of the reviews of the S7, so the S8 pro ultra it was. I also did not want a robovac that I had to manually switch the mop piece out, knowing that I would never do that. I read reviews for other robot vacuums and it sounds like all of them give out after about eight months so this felt like more of an investment. This brought me to Robbie the Roborock lol. This guy cleans to perfection. You think your house is clean until you empty the dirty water bin and realize you’ve been living in filth. I have a large dog who has short hair and Robbie the robot has no issue, slurping up all of his fur and any mud he brings inside. My dog typically goes after the vacuum, however he has no issue with Robbie especially once we did some desensitizing to it using lots of high-value treats. Outside of that my home has never looked cleaner, and I no longer feel embarrassed when friends come over and I start to notice little dust bunnies in the corners of rooms. You can tell when Robbie’s been working because the house shines and smells great. The only bad side of any vaccuum/mop machine The dirty water basin does not smell good when you empty it, so I am going to try the recommendation online which is to buy a toilet bowl gel stamp for the top of it. We will see how that goes. I’ve only had to empty it twice, though. I’ve had Robbie for a few months now and could not be more thrilled about the purchase. Highly recommend.;5
Jessica;Yes, it’s worth the money;December 20, 2023;United States;We have cherry wood floors. Constant footprints from kids, if I didn’t have a robot mop, I’d go crazy. Why this insanely expensive robot mop? We tried multiple brands and even different roborocks, none of them are as impressive as this guy. The other mops leave streaks, the tank runs out of water before finishing my home (the s8 pro ultra goes back to the base and refills itself), one mop tried to mop my area rugs (this mop can tell the difference between floor and rug and it picks up its mop pad and vacuums the rugs). This mop can run 3-4 nights before having to empty the dirty water tank or fill the clean water tank. The other mops throw down a lot of water on my wood, while this mop throws it down and sucks it back up which is better for my wood and also likely why it doesn’t streak. I feel that it is more hygienic- this mop goes back to the base frequently and rinses the mop pad. It also picks the mop pad up off the base so that it can dry. Seems more hygienic than reusing a wet, dirty mop pad that has been sitting wet for a few days. Yes, I would buy it again. Do people judge me when they find out how much this thing cost me? Apparently so. Oh well, I have a new best friend. :);5
Will_Tx;Works well but customer service is terrible;August 9, 2023;United States;Prior review: The instructions to setup the robot are terrible and my battery isn’t charging. On top of that, customer service sent me incorrect info on how to charge it, I had to do my own research after to realize they gave me the wrong info on a subsequent email. I haven’t received any further responses from the vendor and explained that a brand new product at this price point should be working. They’re indicating I can expect to hear back in 24 hours and they’d need to go through warranty now. Update: I ended up giving up with their product support, returning the product, and giving it another try. Their customer service may be ATROCIOUS but their product is top of the line. It’s night and day comparing to the roomba. It’s significantly smart to, less likely to hit your furniture, leaves your floors beautiful, and works very very well. The only thing that is annoying is you can’t silence the verbal descriptions as it goes through things: “washing the mop”, “starting manual run”, etc Would have gotten 5 stars if my initial interactions with customer service were not so bad.;4
Terry Love;Love it! It’s wonderful!;January 7, 2024;United States;;5
Curt;Amazing So Far!;August 5, 2023;United States;Cleaning Performance: While we have only had it a few days, our floors have never looked better! We have been using Bona on our new engineered hardwood floors for the past year and they always looked like they had a film on them and generally looked dull. Furthermore, after cleaning them with a lot of pressure, dirt would still rub off with a paper towel so they weren't really clean. After doing a deep clean mop using only water, the amount of dirt is astonishing and confirmed my suspicion that the bona was not really cleaning the floors. It also does an amazing job vacuuming the carpets and hardwood. We have a border collie that sheds a lot and it is great not having hair tumble weeds floating around and stuck in the carpet. And it has already saved us a bunch of time not having to pull out the upright and mop. Mapping & Obstacle Avoidance: We have a 4,400 sqft house with about 2,400 sqft downstairs and it only took about 30 minutes to map it with great accuracy. It is also great at avoiding obstacles and recognizing chairs, shoes, scales, etc. The App: The app is great, there are tons of features and configuration options and it is very easy to use. The ability to name rooms, create virtual walls and no-go zones is also very helpful as it did get caught up behind a toilet in our water closet due to a black rug bunching up. Only downside is that it does not like black rugs due to the cliff sensors so it will avoid them sometimes. However, after doing some research this affects all robot vacuums so it is not specific to this model or brand. As a result we decided to replace our black 8x11 shag rug in our great room with something lighter. Overall, this thing is amazing, while very expensive, I believe it is a great value as I can trust it to clean better than we were able to and is saving us multiple hours per week.;5
Gerry Pez;Saves time;March 4, 2024;United States;;5
Jim Robx;Very impressive so far. Puts my previous two Roomba's to shame;July 13, 2023;United States;"I have about 2700 sq ft of porcelain tile with just a few area rugs. I've only had the S8 Pro Ultra make one vacuum and mop pass through the entire house and it's very impressive. These are the things that stand out for me: 1. Mapping is very precise. After one false start I followed the instructions and opened all doors and let it do it's thing. It created a single map of every room which I was then able to split up and label as separate rooms. From there setting up a detailed schedule was easy. 2. It was easy to setup ""no go"" zones. You start with a rectangle which you can stretch and rotate to the needed size then place on the map. Add additional rectangles for complex shapes. I have an U shaped couch (red outline in middle of picture) which required three of these rectangles but was easy to setup. 3. I wanted to set up a cleaning zone in front of the food prep area of the kitchen (white object left of couch is the cooking island). I only wanted to cover the area between the gas range and the cabinets behind it. Cleaning zone creation is similar to ""no go"" zone setup with one major flaw. You can resize and move the cleaning zones but you cannot rotate them. That required me to create multiple overlapping rectangles to cover the odd angles of the area. I hope this works because after creating a ""routine"" using these zones I can't see them in the App anymore. I hope the App developers see this because these two changes would make a great product even better. 4. Performance of the mop feature is outstanding. My floors now feel ""squeaky clean"" again. 5. I don't use Alexa for security reasons so won't be evaluating it. I'll update this review as I get more experience with the machine. 6. Human engineering miss. The fresh water tank lid must be held open during a refill making this an unnecessary two hand operation. (see video)";5
Ryan;Error 44;December 30, 2023;United States;If anyone purchases this and gets an error 44 message the first time they use it, meaning the dirty water won’t get sucked up into the tank. I took off the back panel of the housing unit and found that the hose must have been kinked during assembly. Simply move the hose to the slot created and put the back, back on. Works fine now. I’ll update once the mopping has been done. Everything else works good.;4
Amazon Customer;So far, so good;July 27, 2023;United States;Environment: approx 1700 sq/ft of luxury vinyl plank. Two adults, two kids, a large dog (mastiff breed), and I set it to ignore all the rugs (they’re Ruggables, so we toss them in the wash when they’re dirty). We’ve had it just under a week, and it’s been a noticeable game changer. It’s so nice not to have to manually clean the floors. This has already saved us hours of time, so as long as its durability matches its ease of use, this thing will absolutely pay for itself in time saved alone. We’ve tested all the settings and haven’t had to use anything higher than the “medium” settings (balanced vacuum, moderate mop, and standard route). On this setting, it definitely gets all the dog hair and paw prints, all the grass from outside, the crumbs by the table…everything. It mops up all the dried dog slobber. Truly, we’ve had no issues with the cleaning power so far. Quirks: it is determined to clean under the dining room table, even when all 8 chairs (total of 32 legs) are down. It would probably get stuck in there long enough for the battery to die if I hadn’t altered the map to avoid it. When the chairs are up, it effortlessly navigates the four table legs. Cons: the wheels leave tracks when it mops. Our floors are dark/multicolored (made to look like dark hardwood), and you have to look at the right angles w/ the sun coming in to see them, but you can absolutely see the wheel tracks after it mops. This doesn’t bother us one bit because it’s a small price to pay not to use the Bissell ourselves, but this may be a huge deal to some buyers. All in, this thing is awesome. We have schedules set, so we just make sure the kids pick up their toys and this thing does the rest. Really couldn’t ask for more;5
nmmarvel;For those who love a clean floor;June 1, 2023;United States;"I haven't written many product reviews; maybe one? However, this product compelled me to write a review the day after receiving it. I purchased this unit, the series 8 after both my iRobot vacuum and separate mop died within a month of one another. One has to question engineered obsolescence..... Regardless, I chose this one because it was a mop/vacuum combo; however, I did have reservations regarding the ability to function well as both. From the moment you pop the box open, you know it's a quality product, just in the way it is packaged with care and thoughtfulness. The app is vastly more dynamic than the iRobot mop app I used previously. I had the latest, greatest iRobot mop and vacuum, and it took several attempts and about 4 hours each time to map my home. This mop/vacuum did it in about 10 minutes....it was a sight to see. I have two dogs and live in the country, my home is one level and has about 1900 square feet of hard floors (luxury vinyl tile), and I despise dirty floors. I love walking on a freshly mopped floor and not having particles stuck to my feet, and this does the trick. If you're looking to get away from ever vacuuming and mopping again wholly, you'll need to wait a few years until we have fully functioning robots, but...if you love having a clean floor, daily, without particles of dirt, grime etc. sticking to your feet, this is for you. We have large windows and get a lot of sun, so for us OCDer's the streaking is a little hard to look at. When it gets to me, I run my sweeper mop/manual mop over the area a bit, however, this unit does a FAR better job at leaving fewer streaks than the iRobot mop did. The app allows you to select a cleaning direction that aligns with the grain of your floor, having a much better-looking end result. Overall, I am amazed by the technology of this Roborock S8 Pro Ultra, and I'd highly recommend it to everyone who loves a clean floor!";5
Amazon Customer;Fantastic!;March 30, 2024;United States;I'm in love with this! Best purchase I've made in a long time! My floors are getting done while I'm doing laundry!!;5
Phil;Skeptical but very satisfied;September 5, 2023;United States;We have a multi story home with several styles of carpet, wood and tile. We also have several area rugs. I spent a lot of time researching different robot vacuums. Other family members had purchased the shark and roomba robots all to pretty much stop using them in under a year. The combination of vacuum and mopping is what caused me to want to get the Roborock despite the dissatisfaction in competing brands on vacuuming only robots. After getting the robot we let it conquer each floor of the home. We learned quickly to get cords out of the way. A blind cord got wrapped in the Roborock as did thinner electrical cords. Spending a few minutes getting cords out of the way is worth the effort. We also confirmed that the vacuum does not like high pile area rugs. We just created no-go zones in the app to avoid the issues in one of the rooms. The vacuum runs a lot longer than it would take to vacuum but it is also more thorough in most instances than I would be if I were vacuuming. It is able to go under the beds and other furniture that we would not always vacuum or mop. Sometimes it chooses what I think are unusual patterns but eventually covers the entire area. The maps in the app can confirm that it did or did not clean a particular area. I wouldn’t throw out your current vacuum though…. We still need to use the old one do the stairs and cover the area rugs that the Roborock cannot handle. In the end we have concluded that the signicant investment is worth it. It saves us time and we are able to keep the floors cleaner than we did before purchasing this vacuum/mop.;5
Blake Campbell;Fan error 155;March 4, 2024;United States;I’ve had this thing for barely a month and getting a “fan error 155” that has made it non functioning. Prior to that it’s worked perfectly and been a pleasure to have in the house. when it works it works very well Update - customer service has been very helpful and did more than expected since it broke so quickly.;5
Elliott Lum;Like having a maid;February 2, 2024;United States;A truly remarkable machine which dramatically outperforms the previous machines we’ve had from Neato and Samsung. What makes this machine so impressive is it’s ability to vacuum and mop and automatically adjust for carpets and floors. The mop even cleans itself. Navigation around obstacles is excellent. Once your house is mapped, and the rooms identified the named you can selectively clean individual rooms using Alexa commands or the map on your smart phone. This was the top of the line machine when we bought it, but Roborock just announced several newer models at CES which will be available in April.;5
Mark A. Crothers;Great robot... pathetic cleaner.;April 7, 2024;United States;I used to have a Roomba S9. It got lost and stuck all the time and I tired of searching for it. This robot does a wonderful job of obstacle avoidance and mapping. You can always find the machine live in the app, you can easily tell where it has cleaned and what path it is on. When things go wrong, there is nothing ambiguous about what you have to do to fix it. Any clogs or tangles are easily cleared. The rollers and filters are robust and last a very long time. It realizes the difference between hard floors and rugs. Changing water and bags is a breeze. However... and this is a BIG However... This thing can barely clean at all. Basically it sweeps some of pet hair into balls that I have to pick up, the rest stays where it lies. I have mine set to multiple passes at maximum cleaning, but I have to use my regular vacuum often in order to get the majority. One of the weirdest choices Roborock made was to have the cleaning base suck dirt out if the robot's bin back through the rollers and out the same path it came in. This does not work well. The result is that the bin often remains full, and there is no way to know that the robot is now just traveling around making noise because it is still full. It nicely wipes the floors, but I would not call it a mopping. Just a wipe. It will keep hard floors from being dusty, but will not for example remove a pawprint from a dog that came in from wet grass. All in all I'm dissapointed. It is by far the most expensive cleaning robot I have ever purchased, and I have owned 4 of them... It is certainly not worth it.;2
Garyarmy;Horrible Streaks;March 20, 2024;United States;I sent in a ticket for the problem and first no one answered the calls, so I emailed and they provided routine things to do that I already had done! I had high hopes for this unit but for mopping it’s worthless unless you want streaks everywhere! I bought the extra mopping pads and replace them before every use and had the setting to return to base for cleaning the mopping pads every 10 minutes of use! I tried only water and also bought their cleaning products and the results were the same! The vacuum is awesome and if I hadn’t paid so much for this then I would keep it for vacuuming but my house is 80% tile and I need the mopping to work better!;3
Michael;Easy to set up, works like a charm.;December 14, 2023;United States;"It's expensive. However, it's worth the price. At our house, we're all either working full-time jobs or going to school. As a modern labor-saving device, I think it's worth it. The Roborock S8 exceeded my expectations. We have only been using it for about two weeks. It cleaned the floor better than I anticipated. We usually ditch the shoes at the front door. We can now easily walk around in warm socks or bare-footed and it's clean. Our floor is faux wood composite laminate. The Roborock did great with this floor, even getting the edges at the baseboards with its little sweeper brush. It did struggle with rugs. We have a mixture of thin polyester rugs at the home entrances and higher-quality wool rugs inside the living areas. Roborock sucks up the cheap rugs and takes a minute to figure out the higher wool rugs. Once it got on the wool rugs, it did a good job. Going to buy double-stick tape for the thin rugs. It's smart. It went under the couch and found my missing flipflop. Reported it on the app. It also told on the dog when she investigated too closely. The setup was super easy. Get your home in order and hit the quick mapping function. Roborock did an admirable job of mapping the floor plan. It got confused by a mirror. It sees it as a ""closet"".";5
ShawnTheShow;I echo the other 5 stars;January 25, 2024;United States;"This thing is like a NASA invention that they decided to downgrade and just clean floors. It's so smart, I'm starting to suspect it knows more about my house than I do. I mean, it navigates around like it's got a PhD in vacuumology. It's picking up dirt I didn't even know existed – makes me wonder what I’ve been doing with my life. And the app? I can control this thing from my phone. It’s like I’m living in the future, except the future is just me not having to vacuum. It’s so quiet too, half the time I don’t even know it’s there. I could be talking to someone, and it just silently cleans around us, like a polite ghost who’s really into tidiness. Honestly, this vacuum doesn't just clean; it makes me feel like I've got my life together";5
