username;title;date;region;text;stars
Andrea Gonzalez;Great vacuum;January 21, 2024;United States;I bought this robot vac after my cleaning lady quit, as my white tile floor gets extremely dirty with 2 crazy shedding dogs (corgi and husky), a cat and 2 messy cooker humans. My parents had a 2020 iRobot vacuum and it was honestly very disappointing. It always got stuck in cliffs, constantly got lost, and always had errors preventing it from following the set schedule, so I was skeptical. I couldn’t be more happy with this purchase. It’s been just about two months of use, I run this almost everyday to keep the place presentable and I have yet to replace the dust bag (will probably be this week). It requires the perfect amount of work, and have only had to reboot maybe twice. I do regular vacuuming and mopping throughout the week with this thing with the deep+ option always on and never let it vac/mop simultaneously, I always have it do it separately. Once a week I remove items like chairs, trash cans, dog beds, dog crates, and any other easily movable objects to other rooms to have it get the hairs that build up in random places. It usually does a great job at getting everything clean in the first go, although it does struggle a bit with tough stains in my kitchen, but spraying them with water before usually does the trick. I also like using the remote control option if it’s just not handling it correctly (takes 5min out of my time, and minimal physical effort. I refill and empty bins once or twice a week. And remove any stuck hairs between brushes also once a week, i love how everything is easily removed. The only thing i hate is that rotating sweeping brush that’s on the side, because it bends due to it hitting walls and other objects. But it comes out brand new after putting the bristles in boiling water for a few seconds. Great purchase overall. It’s also very entertaining watching it clean. My cat has a vendetta against it, and is always taking it out of the base. A bit inconvenient with multiple level homes because you have to pick it up after it’s done. But that’s not the robot’s fault.;5
Robert A. Reinsch;Changed my life;May 4, 2024;United States;;5
Randall Stewart;This mop is an advancement in floor cleaning!!;December 8, 2023;United States;"So I have waited a week after we got our S8 setup and running in the house. We have white porcelain tiles (big ones 2x4') throughout the whole downstairs. The kitchen, Family room and foyer are close to 1500 sqft. And my wife, since buying the home in 2021, has been swearing the floors will kill her. White tile is hard to keep clean especially in the kitchen. So early on I bought a Roomba i7 and a Brava jet mop. Now they work more or less but often times they are ""lazy"". In that they don't dock right and then you have to notice that they are not doing there job and go futz with them to get them charging again. I have moved these guys out to other areas. The Brava jet worked as long as you dolled it out in small areas. Which means every day it I would have it deal with about 1/2 of the small tank on it. And every afternoon I would have to clean the pad and fill the little tank. Really quite a lot of work, and after about a year of doing that I just said forget it.. too much work for what you get out. I saw the S8 a while ago but the price put me off a bit.. I finally decided to splurge and try it. Wow is all I can say. It vacuums and mops and it does so efficiently. Instead of just wandering around like the roomba's do it maps out the floor and goes back and forth like I would if I was mopping. Then periodically while mopping/vacuuming it pauses announces its going to wash the mop and goes back and does so. Even better we do have carpets down and it recognizes that, lifts its mop up and just vacuums those areas. It is just stunningly amazing. Our floors now are cleaned every day and even at that its amazing how much dirt it gets up. And the water reserve is great too, all I do is about every other day go down, dump and clean out the dirty water (and it is always grey let me tell you could have something to do with our puppy :D ) and then fill up the clean water bucket. This is truly a revolutionary advance in cleaning. I just can't say enough good things about it. Now the only question will be how long it holds up. If something happens I will update the review. And I did notice in the manual every few weeks I will have to do a bit of cleaning and servicing.. but considering how wonderful it works I am fine with that!!";5
C;Amazingly self-sufficient robot!;November 19, 2023;United States;After three weeks of heavy usage, I really love this robot. I’m extremely impressed by its navigation and obstacle avoidance capabilities and how close to hands-free it truly is. “Rosie” (of course!) has gotten/kept my house cleaner than it was for a long time. Rosie almost never gets stuck, especially now that we’ve identified a couple trouble spots to mark as no-go zones, and just goes about her business cleaning. My house is fairly large and is home to a cat and a dog, who like to shed everywhere. (It’s really neat when one of the animals sits in Rosie’s path long enough for the “cat” or “dog” icon to pop up on the map in the app!) I now have Rosie scheduled to vacuum high traffic areas every night, which keeps things under control. My downstairs is mostly hardwood and tile, with a few area rugs. The S8 Pro Ultra’s self-filling and self-washing makes the mopping functionality truly useful—it requires multiple refills to get my whole downstairs mopped, which would rarely happen if I had to refill by hand. Overall, this robot admirably meets my needs. My prior experience with a robot vacuum was roughly 18 years ago with the then base model Roomba. It was neat at first, but eventually felt like more trouble than it was worth. I was spending more time picking up the floor and unsticking/cleaning/emptying/maintaining the robot than it would take me to just hand vacuum the small condo I lived in at the time. I gave up on robot vacuuming until the technology advanced and, in the meantime, moved to the larger house with more extensive cleaning needs. The S8 Pro Ultra seemed to be the more advanced robot I was waiting for, and I have not been disappointed. This machine avoids most of the limitations of my old Roomba. I have noticed a couple of minor software issues that hopefully will get ironed out with future updates: 1. Some glitches with naming rooms on the maps, especially when trying to assign custom names. 2. Multi-level functionality could be a lot smoother. Getting the robot to switch maps is cumbersome, especially when you just want to do selective room cleaning on the new floor. And the robot then thinks its dock is on the new floor too. Other than these minor issues though, I find the app very good and useful. I have been so pleased with this robot that, last week, I got an S8+ at the Black Friday sale price to keep upstairs. My upstairs is mostly carpet, so the Pro Ultra’s mopping functionality is less needed up there. So far, the S8+ is also meeting my expectations. And it’s fun having two robots at my command.;5
J.Steve;Great app, but cleaning power is lacking;January 6, 2024;United States;"THE GOOD: This unit has an amazing app. It can save multiple maps so that it knows the rooms in each level of my house, and if I put it in a random spot and tell it to vacuum a given room, it'll correctly orient itself in ~20 seconds and do as requested. I can also use the app to highlight 1 or more specific area and it'll head straight there, which is great if we spill something on the floor etc. It is much quieter than my Roomba, both because the vacuum itself is quieter but also (importantly) because it doesn't bumble around bumping into things and causing a racket. I also love that it vacuums room by room, so it'll fully complete a room before moving on to the next one (once you've defined each room on your map). And the app lets you track its specific progress in real-time. It gets stuck less often than the Roomba since it's able to identify and avoid potential obstacles like wires, for the most part. THE BAD: First off, this is a minor thing but it really disappoints me: the Roborock doesn't leave nice clean vacuum lines in my carpet like my Roomba does. When I come downstairs in the morning I can't tell if the vacuum has run or not without checking the app. By contrast, the Roomba always left the carpet looking more freshly vacuumed. Second, the suction power seems fairly weak, even on the max setting. Sometimes I'll find crumbs on the floor (even the hardwood floor) even after doing a vacuum and mop cycle. I'm hopeful that I may be able to address this myself by changing the filter more frequently, or having it make more passes each run, or using the ""Max+"" setting (which temporarily disables mopping and uses full power for vacuuming).";4
LT;I like it a lot but unfortunately it does not work with 5G WiFi;April 24, 2024;United States;This is my second Roborock and I must say I like it a lot. It’s smart, cleans well, the apps has a lot of functions. My only complaint is that it does not connect to 5G WiFi, only the 2.4G ones. I did not know about this until we recently upgraded our WiFi router.;4
Creepshow2000;Amazing!;April 17, 2024;United States;I watched it clean my place for the first time and was waiting for it to fail. I kept wanting to laugh or crack a smile every time I thought it was getting confused or stuck. I really wanted to think we are so far from this technology being viable. But I was wrong. Not only did the unit wow me and exceed my expectations, but it never got stuck, confused or failed to provide a fantastic cleaning, even on it's first try! Very impressive technology and would buy again without hesitation.;5
Keiko;"Roborock's tagline of ""Forget about cleaning, really"" is very true with the S8";May 5, 2023;United States;I own a 2nd or 3rd generation Roomba, but with 2 cats and 2 huskies, it just wasn't cutting it anymore. The upgrade to the s8 is like a whole other level of cleaning. I should have done a before and after picture. The difference is that astounding. Let me start with the #1 reason I got the s8: NO CAMERA Some people may consider this a negative, but as someone who works in the technology sector, I can't warn people enough. BE CAREFUL WHO GETS YOUR PERSONAL INFORMATION. In this case, I didn't want pictures of the inside of my house going to the internet. (Have you seen the story of the woman who had pictures of her on the toilet sent to the internet by her robot vacuum? That [or worse] can happen to you too.) The s8 uses a lidar system that I dare say is the most accurate at mapping and avoiding obstacles that I've seen. BRAVO and KUDOS to Roborock for using this mapping solution instead of a camera and taking steps to protect my privacy. The ENTIRE tech industry needs to start trending this way. (Yes, I understand the irony of saying this on Amazon.) I watched it as I sent it on it's first mapping run of the house and then as it started it's first real cleaning job. The app interface is incredibly accurate. It showed me what the s8 could see and also showed me where the s8 actually went, tracing it's path with a white line and marking obstacles accurately. In fact, I noticed that the s8 had avoided a spot that had no obstacles, so I checked the app and saw a little cat face icon, letting me know that it was avoiding the fur baby and would get that spot on another pass later. Incredible! And other things I didn't think it would recognize, it popped up an accurate icon for (such as a bar stool and even a pet bed and kennel!) Mopping is completely hands free with Pro Ultra Rock Dock. You only need 1 a cap full of the cleaning solution per each fill up of the clean water tank. I ran the s8 at full intensity 4-5 times from evening to overnight via scheduling (I was really breaking it in) and in the morning I woke to find a pop up letting me know to empty the dirty water tank and fill up the solution. The dock also cleans the mop for me as well as air-dries the pad to prevent mold. As far as noise, the noisiest part of the entire experience is the 10-15 seconds the dock empties the s8's dust bin. Other than that, the s8 is so quiet even at MAX+ power, I was concerned that it wasn't operating at 100% (compared to the extremely noisy Roomba I previously had.) On quiet modes, the s8 is so quiet, you may not know where it is without looking at the app. There's so much more I could say, but I've gone on long enough. If I had to come up with a negative, I'll say that there are so many features and settings available in the app, it can get overwhelming to non-techie folks. Oh and for those of us who are techies - one negative is that if you're the type of person who keeps your data secure, the app has a hard time if your phone or tablet is connected to a VPN. You'll have to disable it for the first time connection. Other than that, I don't know what else to say. Want to not have to think about cleaning? Get the roborock S8 Pro Ultra;5
Alex;Best robot vacuum by far!;March 8, 2024;United States;"I've owned multiple Ecovac robot vacuums, and I finally had enough of their issues to try something new. So far, I'm extremely happy with the Roborock. The vacuum is way more intelligent. It doesn't get stuck at all like the Ecovac I had, which would go haywire and back into everything. The Roborock also has many settings you can tweak to fit your life and house. I have a mix of carpet and hard floors and even the actual cleaning function has been hands down better than my previous vacuums. The big test will be to see how the longevity of the dock and vacuum hold up over the next year. However, after a solid 3-4 weeks of vacuum cleaning daily, everything has been working great. I've also not had any issues with the map freaking out and disappearing or creating a new one. I had this problem every other day with the Ecovac and had to go through, delete the map, and have it start all over. It was really interesting as well to see how the Roborock can identify objects correctly; for example, it showed on the map that it had detected an actual shoe that one of my kids had left out.";5
Sandy Campbell;Totally Awesome machine, with some caveats;December 25, 2023;United States;This machine is an awesome mopping and sweeping machine. You can control the suction power in different rooms, set different floor materials, and much more. It has been a lifesaver for me. The reason I only gave it 4 stars is because there are some downsides. 1. In order to work the machine with the app on your phone, you have to have 2.4ghz internet, meaning your 5G has to be split. That took some doing. It works perfectly now that it's split. 2. The MAJOR issue for me has been trying to program the machine to clean rooms in a specific order. For almost a month, I was emailing and calling Roborock DAILY, trying to figure out why I can't program this machine to clean rooms in a specific order.  For the first 2 weeks or so, I was asked to send pics of the map of my home, told to do different things to make the app divide the rooms so the Sequence option would show up, etc.  For the next week or so, I was told that the machine can't be programed, and the Sequence option isn't available.  I can't tell you how many days of my life I've wasted trying to work this out. The representatives obviously have no clue how this machine works. After spending many hours trying to figure this out, I finally got it. You CAN program this machine to clean in a specific order. If you set up zones on your map, the order in which you set the zones, is the order that the machine will clean in.  i.e.:  The first zone you set is the bathroom, 2nd bedroom, 3rd kitchen, 4th laundry, 5th den, etc.  The machine will clean the bathroom 1st, bedroom 2nd, kitchen 3td, laundry 4th, den 5th. I hope this is helpful because it drove me nuts!;4
Y. Belopolsky;Truly the absolute best and worth the hours in your life spent cleaning;March 3, 2024;United States;;5
KlaudiaG;It really mops!;March 5, 2024;United States;I took a while to decide which robot to buy and I’m so happy we picked these one. Last robot we had was a Roomba and a Braava to mop and the braava was just so disappointing. Roomba was ok, but it’s miss spots here and there. The Roborock is so superior to those too combined. Our braava would only get the floor wet, but my perception is that it wasn’t heavy enough to actually clean. I have two messy kids who love “to cook” a dog and a cat, so moping is hard work here. I had my doubts but after reading so many great reviews I decided to splurge and get it. It MOPS!! it looks like when our cleaning lady does it 😁 I am beyond happy with the way our floors and carpets look. Also it’s our first robot with smart mapping, love that it can learn different maps. I know I’m a little late to the party, but I’m amazed. To be able to divide rooms, pick materials, the orientation of wood, etc. its great. Also our house is big and it takes waaay less than our Roomba used to. Buy it, you won’t regret it;5
Lisa;Why did I wait so long????;April 2, 2024;United States;;5
Jayme Pechan;Finally one I like;December 26, 2023;United States;I have had various other brands over the years and they all suffered from the same stupid software issues. Here are the things that I have noticed that the S8 does better than all the other ones I have tried… 1) the mapping mode would just enter the room and look around. It didn’t have to cover every square inch like the others. So the full map only took a couple minutes. When it finished this, I asked my wife… did it even do it? So she showed me the map in the app. Omg, it was awesome. 2) its auto breakdown of the rooms was not great but I was able to merge everything together and split at better locations. My wife struggled with this but it wasn’t bad and only needs to be done once. Compared to others, this was simple. 3) it finds the walls and obstacles without running into them. My wife has had to paint the baseboards so many times over the years because the other brands would just constantly run into the walls. This one doesnt even run into a balloon on the floor. How cool. 4) i had to pause and move it once. Other brands would be completely lost at that point and would not make it home. The S8, figured out where it was and picked up where it left off. Omg amazing. 5) it is only one machine and would vacuum and mop on the same pass. Its hard to describe how much faster it is this way and it works well. 6) it is so quiet compared to the other ones i had. Although I haven’t tried, i could probably do a conference calls while this is busy in the same room. Most of my house is tile with bedrooms carpet and we out a rug in the living room. Works well on all these. I was commenting to my wife that this is the first one I actually like. The others were noisy and irritating and she would have it run all day.;5
George M.;My roborock stopped working several weeks ago;February 14, 2024;United States;While the robo was working it did a good job. Do to my wife's stoke she is unable to help care for our home. It was very helpful in keeping the floors clean. Make long story short I took the implications of roborock support distasteful I felt insulted by thier instruction on returning the item for repair. So, I gave the roborock a decent burial and trashed it. This is the third time had problems with high dollar purchases. I don't blame your company I blame the companies and delivery service for broken items two of which I repaired after they arrived. Im considering local direct buy only on high dollar items.;4
Pyre8;It does a fantastic clean up!;May 2, 2024;United States;;5
Adil Hussain;Never mop or vacuum again;April 1, 2024;United States;;5
Stephanie S.;Best robot vacuum purchase I have ever made (and I've made a few);January 6, 2024;United States;"They say you get what you pay for, and it's never been more true for me than with this purchase. This is my 4th robot vacuum (2 Ecovacs and 1 Roomba previously), and this one far outshines its predecessors (it also was the most expensive). But it has been worth every single penny. I have two large dogs (a St. Bernard and a Golden Retriever), and they shed like it is their JOB! All previous models got the hair tangled up in the brushes/wheels (both), or the suction wasn't strong enough to empty the bag into the base (Ecovacs), or they didn't do a great job (both) - but this one has been phenomenal. It does an amazing job picking up all debris, dirt, and dog hair, and I've had no jams at all. The brushes detangle themselves, and the main multi-directional wheel is easy to remove, so if/when hair does build up there, I can just pop it out to clean (the Roomba had this, too; Ecovacs did not). The mopping feature works really, really well and I LOVE that it dries the mop head so no smelliness. My Ecovacs (supposedly) mopped, too, but it did such a poor job that I never used the feature. Plus, it had to run separately from the vacuum (attach mopping head). This one is all built-in and does an all-in-one. It actually ""lifts"" the mop head out of the way when it detects carpet. The app is great; scheduling is a breeze. It doesn't ""lose connection"" to my network constantly (looking at you, Roomba), and it displays a very accurate map, allowing me to see just what has been vacuumed/mopped. All-in-all, I couldn't be more pleased with this product, and I highly recommend it to anyone who wants the best and is willing to pay the price for it. I would buy it again. No question.";5
BRLbeleza;Great robot!;January 30, 2024;United States;It’s louder than I expected and talks a lot, announcing its actions lol but it cleans fantastically. I moved into an apartment with vinyl tile flooring and hadn’t yet mopped or vacuumed in 2 months. There were little bits of cardboard and tape from cutting moving boxes open and a few crumbs in the kitchen and some visible dust bunnies throughout the space. I ran it for the first time yesterday evening. It mapped the space well and got to work. It ran for a bit, announcing it was cleaning the mop 2 or 3 times but when it announced it was done and returning to the dock I was truly impressed. It collected everything. The main brushes jammed once but it was a breeze to remove the item and reinstall the brushes. The only thing I’m not wowed by is the Roborock app but I’m figuring it out. It was definitely a splurge that I’m still paying for but so far I’m delighted with it. This is my third robovac/mop and by far the most expensive one I’ve tried. Unlike others I’ve had, this one did everything itself. No installing a mop pad or cleaning it or guiding the robot around obstacles or picking it up to have it run over an area a second time… outside of clearing the jam I did nothing. They’ve engineered a really terrific machine here. Recommended—if it’s within your budget this is the one to get!;5
W. Stebler;SO much better than iRobot;December 24, 2023;United States;I've had an iRobot J6+ vacuum (the one with a camera specifically made to avoid pet poop) for a few years now and although I've been generally pleased with how the iRobot cleans, the robot's ability to navigate is simply horrible. I've watched in amazement many times as it seemed to turn back and forth randomly as if completely confused. Sometimes it comes out of the dock and immediately gives up trying to go to a room that is clearly on its map. Crazy. The Roborock S8 Pro, which uses Lidar, maps the entire space in about 10 minutes and flawlessly moves around the house without hitting things continuously. It still has trouble from time to time, but in general it operates so much more intelligently. The app and capabilities are much more advanced as well. Vacuuming is good - at least equivalent to the iRobot. Mopping is decent, but the mop is not exactly as wet as I would like it to be. If the floor is not flat, it can miss certain areas.;4
Sharon Capizzi;Good but not great so far;December 15, 2023;United States;I have been using the roborock 8s pro for about 3 weeks. Overall, it seems to mop & vacuum really well especially on the highest setting. I have about 1300sf of polished Travertine and it is shiny after a mopping on high! It makes really well with a minimum of adjustments to separate rooms and delineate where rugs are and no go zones. ( I even did a no go zones around the Christmas tree skirt and it worked perfectly! The only 2problems I have experienced is 1 major and 1 minor. The minor is that it has a bit of a problem getting up into an area low pile rug in my LR but it does finally make it. The MAJOR problem I have is that it is not self evacuating the dust bin. I have been in contact with tech support regarding the problem. They were very nice on the phone and then send you a bunch of pictures for you to compare how yours is set up and how it should be which was helpful but didn't fix the problem. Apparently there is some magnet on the dust bin that is necessary and perhaps I don't have it. That part was never made clear but they offered to exchange it for a new one. I did ask if it was a refurbished unit and they said it would be new. In the end I chose to return it thru Amazon as I felt I should stay protected by the return policy in case there was any warranty issues. I'll adjust my post when I get and use the new one thru Amazon.;4
